{
  "header": {
    "schema_id": "document_source.native_resource_catalog",
    "schema_version": "2.0.0",
    "contract_id": "native_resource_catalog_contract_example001",
    "content_hash": "37a898fc540b5435a4564fef45a8ff943c12c1678a26328efe8523b55a456d08",
    "producer": "vysi.document_source",
    "producer_version": "0.2.0",
    "created_at": "2026-06-19T20:00:00Z",
    "status": "ok",
    "revision": 1,
    "supersedes": null,
    "extensions": {}
  },
  "document_id": "document_example001",
  "resources": [],
  "occurrences": []
}
